default via 192.168.1.1 dev enp0s1 proto dhcp src 192.168.1.60 metric 100 
172.17.0.0/16 dev docker0 proto kernel scope link src 172.17.0.1 linkdown 
192.168.1.0/24 dev enp0s1 proto kernel scope link src 192.168.1.60 metric 100 
192.168.1.1 dev enp0s1 proto dhcp scope link src 192.168.1.60 metric 100 

21:05:12.123456 IP 192.168.10.50.44322 > 192.168.10.193.80: Flags [S], seq 12345678, win 64240, length 0
21:05:12.123590 IP 192.168.10.193.80 > 192.168.10.50.44322: Flags [S.], seq 87654321, ack 12345679, win 65160, length 0
21:05:12.123610 IP 192.168.10.50.44322 > 192.168.10.193.80: Flags [.], ack 1, win 502, length 0
